,
"If so, can you send me a sample? If not, are there any templates you can recommend to purchase?",Please see the attached example of one of the report formats.
"Can you give a bit extra detail on what digital materials are included, besides video recordings of weekly live webinars?",
I wanted to know if I had any pending issues as to why I haven't received my certificate.,We issue certificates after attendees have completed the tests and the assignment on the online training site. I’ve just had a look and it doesn’t look like you’ve accessed any of the materials yet.
I can't seem to find what I need on amazon. Is there any possibility that you could send me a link to the correct slides? I did find Fisher but I think the size is incorrect.,
"I would like to know if you offer a microscope in dark field and camera for attedendee of the live blood course with installment payment.
I intend to settle a practice in Italy where I am from.
I would like to know as well if i can order the Neogenesis products in Italy.",
I need help replacing one of the lense objectives and on how to use my ToupCam camera. Can you recommend anyone?,
"Do you subscribe to the concept of Blood Type Diets?  Please explain.

Do you have any endorsements on nutrition/diet courses or reference books?",
Do you have a copy of suggested wording for the disclaimer please - the explanation of time line as it seems rather a long time since the lessons?,There is a disclaimer at the end of the client questionnaire on the flash drive / online training site that you can use. I’ve attached it here for you as well.
,
"what are the additional costs in setting up a LBA practice beyond that of the microscope which you offer. Eg. slides, HDMI connector, TV monitor (or is a laptop good enough?), lancets, to name a few.",
"does this beautiful posts come in a smaller, more convenient size? Like a flashcard to have by our sides when we are learning and have a client in front of us. ",
"I would love to take the course , do you have any info if we can start with more affordable microscopes.","Live blood analysis requires a very specialized microscope to see all of the anomalies, if you want to practice live blood analysis to its full potential and help clients, you need a microscope that has this capability and they are not cheap. We have our microscopes specially made for us at the lowest price possible. Anything less will not allow you to do a full analysis which will not help your clients."
,See the video here https://www.youtube.com/watch?v=2pHQuFqxUUY&t=52s
Can you tell me if the price iof the Rife machine includes shipping and handling and other fees as well?,"The price includes free international shipping. We use a forwarder who ships these machines for us with UPS, which is 100% trackable with a 3-5 day delivery time. . There is usually a small import tax payable, which works out to approx. $70 based on the commercial invoice value"
how long will it take to reach me here in USA?,"We are usually able to ship within 2-3 days of payment, so the total lead time is approx. a week"
"What happens if anything gets broken during shipping and handling, will it be replaced?","The machines are shipped with insurance, so if something does break during transit it will be replaced. However the machines are shipped in a protective padded bag, packed inside a larger box with 2” polystyrene padding to keep the risk of damage to a minimum. We’ve shipped several of the Rife machines across the world and haven’t had any cases of damage during shipment."
Is there any training required for the Real Rife Machine,
Can you tell me if this price includes shipping and handling and other fees as well? And how long will it take to reach here? And if anything gets broken during shipping and handling will it be replaced?,
Will the Real Rife machine work in my country?,
Is there any warranty?,The warranty is 1 year.
Is there maintenance and how often?,The machine requires no maintenance as its solid state. As it sweeps through the frequencies every 10 secs or so it does not require calibration either
What is the procedure if any repair is needed? ,"Regarding repairs if necessary, it would have to be shipped back to Cape Town to our engineer at this point. They are however very sturdy and reliable and we have not had a comeback in 4 years yet. We design it to operate well within its limits."
Why is Real Rife better than GB4000 Rife (respectively US $4700 v US $1800) ,"Re the GB 4000, This is a handheld generator that does not do what Rife originally did. It is the MOPA part of it that does do what Rife did to a large extent. We have tested one here a few times that a friend has. I explain the many differences on our Skype Zoom calls. With this tech the devil is always in the detail."
If understood correctly Real Rife is running all frequencies simultaneously in 20 min v GB4000 Rife is running up to 8 frequencies one after the other. What is the rationale and why? - ,"This requires a long explanation and a demonstration, it is something we can answer on the Zoom meetings where we can also demonstrate with a spectrum analyser and oscilloscope."
